{
  "$schema": "https://json-schema.org/draft/2020-12/schema",
  "$id": "https://example.invalid/zipverse/task-packet.schema.json",
  "title": "ZipVerse Public Task Packet",
  "type": "object",
  "additionalProperties": false,
  "required": [
    "schema_version",
    "task_id",
    "intent",
    "scope",
    "permissions",
    "validation"
  ],
  "properties": {
    "schema_version": {
      "const": "0.1"
    },
    "task_id": {
      "type": "string",
      "minLength": 1
    },
    "intent": {
      "type": "string",
      "minLength": 1
    },
    "scope": {
      "type": "object",
      "additionalProperties": false,
      "required": ["targets"],
      "properties": {
        "targets": {
          "type": "array",
          "minItems": 1,
          "items": { "type": "string", "minLength": 1 }
        },
        "excluded_targets": {
          "type": "array",
          "items": { "type": "string", "minLength": 1 },
          "default": []
        }
      }
    },
    "permissions": {
      "type": "object",
      "additionalProperties": false,
      "required": ["capabilities"],
      "properties": {
        "capabilities": {
          "type": "array",
          "items": { "type": "string", "minLength": 1 },
          "uniqueItems": true
        },
        "approval_required": {
          "type": "boolean",
          "default": true
        }
      }
    },
    "validation": {
      "type": "object",
      "additionalProperties": false,
      "required": ["checks"],
      "properties": {
        "checks": {
          "type": "array",
          "minItems": 1,
          "items": { "type": "string", "minLength": 1 }
        },
        "independent_review": {
          "type": "boolean",
          "default": true
        }
      }
    },
    "metadata": {
      "type": "object",
      "additionalProperties": true
    }
  }
}
